{
  "content_id": "practice-001",
  "surface": "reel",
  "title": "تمرینت کجا تمام می‌شود؟",
  "caption": "برای تمرین بعدی، یک خروجی کوچک انتخاب کن. آخر کار همان خروجی را ببین و تصمیم بگیر چه چیزی را تغییر بدهی.",
  "cta": "برای تمرین بعدی ذخیره‌اش کن.",
  "hypothesis": "پیشنهاد یک خروجی مشخص نسبت به توصیه کلی، ذخیره بر ریچ بیشتری می‌گیرد.",
  "primary_metric": "save_per_reach",
  "counter_metric": "share_per_reach",
  "authoring_provenance": "model_draft",
  "evidence": [],
  "frames": [
    {
      "role": "hook", "headline": "فقط تمرین نکن", "text": "آخر تمرین، چه چیزی باید ساخته باشی؟",
      "spoken": "قبل از شروع، بگو آخر تمرین چه چیزی باید ساخته باشی؟",
      "start": 0, "end": 5, "visual": "نمای نزدیک دفتر؛ سؤال با دست نوشته شود.",
      "sound": "صدای طبیعی گوینده، بدون موسیقی", "continuation": "در بخش بعد یک خروجی کوچک انتخاب می‌کنیم.",
      "claim_basis": "instruction", "evidence_ids": []
    },
    {
      "role": "value", "headline": "یک خروجی کوچک", "text": "مثلاً یک پاراگراف، یک طرح یا یک جملهٔ ضبط‌شده.",
      "spoken": "مثلاً یک پاراگراف بنویس؛ همین را خروجی تمرینت بگذار.",
      "start": 5, "end": 11, "visual": "سه کارت ساده، هر بار فقط یک مثال روی تصویر.",
      "sound": "ادامه صدای گوینده", "continuation": "حالا باید بدانیم با این خروجی چه کار کنیم.",
      "claim_basis": "instruction", "evidence_ids": []
    },
    {
      "role": "payoff", "headline": "حالا بررسی‌اش کن", "text": "یک نکتهٔ خوب؛ یک تغییر برای دفعهٔ بعد.",
      "spoken": "یک نکته خوب و یک تغییر بنویس؛ تمرینت پایان مشخصی دارد.",
      "start": 11, "end": 19, "visual": "دو ستون در دفتر؛ خوب بود / دفعه بعد تغییر می‌دهم.",
      "sound": "پایان جمله با مکث کوتاه", "claim_basis": "instruction", "evidence_ids": []
    }
  ]
}
